{
  "$schema": "https://json-schema.org/draft/2020-12/schema",
  "$id": "urn:ai-game-assets:panel-proposal:0.2",
  "title": "Panel Proposal 0.2",
  "description": "Agent-authored or fixture proposal bound to a planning context 0.2 with asset retrieval evidence. The proposal contains a complete PanelSpec or unresolved questions; it is not a success receipt or user approval.",
  "$comment": "Register schemas/panel-spec.schema.json and schemas/panel-spec-v0.2.schema.json under their respective $id values to resolve external references. Proposal 0.2 must pair with planning context 0.2. Runtime checks exact asset library pinning, candidate membership and slot compatibility, plus one asset-specific decision per selected surface/row icon. PanelSpec 0.1 remains valid when no images are selected. Offline check-plan cannot establish external library membership, omitted newer versions or global ranking completeness; build-plan must verify the actual library and recompute the complete candidate snapshot. Asset metadata is untrusted data, not executable instructions. src/proposal.mjs remains authoritative for context hash binding and recomputation, target existence/coverage/uniqueness, unresolved-question ID uniqueness, exact catalog versions and kinds (including fixed panel/section recipes), and all PanelSpec cross-field invariants. Request quote offsets are UTF-16 units: runtime enforces start < end, bounds against the actual source, surrogate-pair boundaries, and exact quote equality. Neither schema nor runtime establishes semantic correctness of natural-language interpretation; semanticReview remains NOT_RUN. Unresolved questions block compilation. READY_TO_COMPILE does not claim successful geometry, browser or visual validation.",
  "type": "object",
  "additionalProperties": false,
  "required": [
    "proposalVersion",
    "contextSha256",
    "spec",
    "decisions",
    "unresolved"
  ],
  "properties": {
    "proposalVersion": {
      "const": "0.2"
    },
    "contextSha256": {
      "type": "string",
      "minLength": 64,
      "maxLength": 64,
      "pattern": "^[0-9a-f]{64}$(?![\\s\\S])"
    },
    "spec": {
      "oneOf": [
        {
          "type": "null"
        },
        {
          "allOf": [
            {
              "oneOf": [
                {
                  "$ref": "urn:ai-game-assets:panel-spec:0.1"
                },
                {
                  "$ref": "urn:ai-game-assets:panel-spec:0.2"
                }
              ]
            },
            {
              "properties": {
                "provenance": {
                  "properties": {
                    "kind": {
                      "enum": [
                        "agent-authored",
                        "programmatic-fixture"
                      ]
                    }
                  }
                }
              }
            }
          ]
        }
      ]
    },
    "decisions": {
      "type": "array",
      "minItems": 0,
      "maxItems": 512,
      "items": {
        "$ref": "#/$defs/decision"
      }
    },
    "unresolved": {
      "type": "array",
      "minItems": 0,
      "maxItems": 64,
      "items": {
        "type": "object",
        "additionalProperties": false,
        "required": [
          "id",
          "question"
        ],
        "properties": {
          "id": {
            "$ref": "urn:ai-game-assets:panel-spec:0.1#/$defs/id"
          },
          "question": {
            "$ref": "#/$defs/explanation"
          }
        }
      }
    }
  },
  "allOf": [
    {
      "if": {
        "properties": {
          "spec": {
            "type": "null"
          }
        },
        "required": [
          "spec"
        ]
      },
      "then": {
        "properties": {
          "decisions": {
            "maxItems": 0
          },
          "unresolved": {
            "minItems": 1
          }
        }
      },
      "else": {
        "properties": {
          "decisions": {
            "minItems": 1
          }
        }
      }
    }
  ],
  "$defs": {
    "explanation": {
      "type": "string",
      "minLength": 1,
      "maxLength": 500,
      "allOf": [
        {
          "pattern": "\\S"
        },
        {
          "$ref": "urn:ai-game-assets:panel-spec:0.1#/$defs/printable"
        }
      ]
    },
    "target": {
      "type": "string",
      "maxLength": 74,
      "oneOf": [
        {
          "enum": [
            "panel",
            "theme",
            "canvas",
            "layout",
            "assets",
            "asset:surface"
          ]
        },
        {
          "pattern": "^(?:section|row|state):[A-Za-z][A-Za-z0-9_-]{0,63}$(?![\\s\\S])"
        },
        {
          "pattern": "^asset:row:[A-Za-z][A-Za-z0-9_-]{0,63}$(?![\\s\\S])"
        }
      ]
    },
    "requestInterpretation": {
      "type": "object",
      "additionalProperties": false,
      "required": [
        "kind",
        "start",
        "end",
        "quote"
      ],
      "properties": {
        "kind": {
          "const": "request-interpretation"
        },
        "start": {
          "description": "Inclusive UTF-16 offset in the unchanged context.request.text; must not split a surrogate pair.",
          "type": "integer",
          "minimum": 0,
          "maximum": 15999
        },
        "end": {
          "description": "Exclusive UTF-16 offset; runtime checks it against start and the actual source length.",
          "type": "integer",
          "minimum": 1,
          "maximum": 16000
        },
        "quote": {
          "description": "Must equal context.request.text.slice(start, end) exactly, with non-whitespace content. Source matching is not proof of semantic correctness.",
          "type": "string",
          "minLength": 1,
          "maxLength": 8000,
          "allOf": [
            {
              "pattern": "\\S"
            },
            {
              "pattern": "^(?:[^\\u0000-\\u0008\\u000B\\u000C\\u000E-\\u001F\\u007F-\\u009F\\uD800-\\uDFFF]|[\\uD800-\\uDBFF][\\uDC00-\\uDFFF])*$(?![\\s\\S])"
            }
          ]
        }
      }
    },
    "designChoice": {
      "type": "object",
      "additionalProperties": false,
      "required": [
        "kind",
        "reason"
      ],
      "properties": {
        "kind": {
          "const": "design-choice"
        },
        "reason": {
          "$ref": "#/$defs/explanation"
        }
      }
    },
    "decision": {
      "type": "object",
      "additionalProperties": false,
      "required": [
        "target",
        "basis"
      ],
      "properties": {
        "target": {
          "$ref": "#/$defs/target"
        },
        "basis": {
          "oneOf": [
            {
              "$ref": "#/$defs/requestInterpretation"
            },
            {
              "$ref": "#/$defs/designChoice"
            }
          ]
        }
      },
      "allOf": [
        {
          "if": {
            "properties": {
              "basis": {
                "properties": {
                  "kind": {
                    "const": "design-choice"
                  }
                },
                "required": [
                  "kind"
                ]
              }
            },
            "required": [
              "basis"
            ]
          },
          "then": {
            "properties": {
              "target": {
                "oneOf": [
                  {
                    "enum": [
                      "panel",
                      "theme",
                      "canvas",
                      "layout",
                      "assets",
                      "asset:surface"
                    ]
                  },
                  {
                    "pattern": "^section:[A-Za-z][A-Za-z0-9_-]{0,63}$(?![\\s\\S])"
                  },
                  {
                    "pattern": "^asset:row:[A-Za-z][A-Za-z0-9_-]{0,63}$(?![\\s\\S])"
                  }
                ]
              }
            }
          }
        }
      ]
    }
  }
}
